{
  "schema_version": "v2",
  "subsystem": "proc",
  "source_root": "/home/libo/work/linux",
  "scope": {
    "module": "fs/proc",
    "search_method": "prefix",
    "scan_mode": "auto"
  },
  "items": [
    {
      "interface_id": "proc:/proc/consoles",
      "interface_type": "file_like",
      "subsystem": "proc",
      "display_name": "/proc/consoles",
      "access_paths": [
        "/proc/consoles"
      ],
      "operations": [
        {
          "op_id": "proc:/proc/consoles#open",
          "op_name": "open",
          "op_type": "path_open",
          "direction": "none",
          "requirements": {
            "needs_fd": false,
            "needs_path": true,
            "needs_socket": false,
            "needs_struct": false,
            "needs_resource": true
          },
          "syscall_bindings": [
            {
              "syscall_name": "openat",
              "syscall_family": "fs_path",
              "syscall_nr_symbol": "__NR_openat",
              "call_form": "openat",
              "arguments": [
                {
                  "name": "dirfd",
                  "arg_role": "dirfd",
                  "type_hint": "fd_dir"
                },
                {
                  "name": "file",
                  "arg_role": "path",
                  "type_hint": "string"
                },
                {
                  "name": "flags",
                  "arg_role": "flags",
                  "type_hint": "open_flags"
                },
                {
                  "name": "mode",
                  "arg_role": "mode",
                  "type_hint": "open_mode"
                }
              ]
            }
          ],
          "generation_hints": {
            "target_style": "syzkaller_alias"
          },
          "analysis": {
            "confidence": "high",
            "evidence": [
              "mapped operation open to syscall binding openat"
            ],
            "manual_todo": [],
            "warnings": []
          }
        },
        {
          "op_id": "proc:/proc/consoles#read",
          "op_name": "read",
          "op_type": "fd_io",
          "direction": "out",
          "requirements": {
            "needs_fd": true,
            "needs_path": false,
            "needs_socket": false,
            "needs_struct": false,
            "needs_resource": true
          },
          "syscall_bindings": [
            {
              "syscall_name": "read",
              "syscall_family": "fs_io",
              "syscall_nr_symbol": "__NR_read",
              "call_form": "read",
              "arguments": [
                {
                  "name": "fd",
                  "arg_role": "fd",
                  "type_hint": "fd"
                },
                {
                  "name": "buf",
                  "arg_role": "buffer",
                  "type_hint": "buffer[out]"
                },
                {
                  "name": "count",
                  "arg_role": "length",
                  "type_hint": "len"
                }
              ]
            }
          ],
          "generation_hints": {
            "target_style": "syzkaller_alias"
          },
          "analysis": {
            "confidence": "high",
            "evidence": [
              "mapped operation read to syscall binding read"
            ],
            "manual_todo": [],
            "warnings": []
          }
        }
      ],
      "source": {
        "file": "fs/proc/consoles.c",
        "line": 113,
        "symbol": "consoles_op",
        "symbol_kind": "proc_ops",
        "source_kind": "proc_create_seq",
        "related_symbols": [
          "consoles_op"
        ]
      },
      "attributes": {
        "resource_kind": "fd",
        "object_kind": "kernel_interface",
        "is_virtual": true,
        "is_path_based": true,
        "is_fd_based": true,
        "is_stateful": false
      },
      "subsystem_details": {
        "node_type": "file",
        "registration_kind": "proc_create_seq",
        "module_file": "fs/proc/consoles.c",
        "ops_symbol": "consoles_op",
        "parent_path": "/proc"
      },
      "analysis": {
        "confidence": "medium",
        "evidence": [
          "discovered proc target /proc/consoles",
          "resolved 2 operations",
          "registration kind: proc_create_seq",
          "resolved ops symbol: consoles_op"
        ],
        "manual_todo": [
          "ops symbol consoles_op was not resolved",
          "using conservative open/read fallback because ops could not be resolved"
        ],
        "warnings": [
          "ops symbol consoles_op was not resolved",
          "using conservative open/read fallback because ops could not be resolved"
        ]
      }
    },
    {
      "interface_id": "proc:/proc/mounts",
      "interface_type": "symlink_like",
      "subsystem": "proc",
      "display_name": "/proc/mounts",
      "access_paths": [
        "/proc/mounts"
      ],
      "operations": [
        {
          "op_id": "proc:/proc/mounts#open",
          "op_name": "open",
          "op_type": "path_open",
          "direction": "none",
          "requirements": {
            "needs_fd": false,
            "needs_path": true,
            "needs_socket": false,
            "needs_struct": false,
            "needs_resource": true
          },
          "syscall_bindings": [
            {
              "syscall_name": "openat",
              "syscall_family": "fs_path",
              "syscall_nr_symbol": "__NR_openat",
              "call_form": "openat",
              "arguments": [
                {
                  "name": "dirfd",
                  "arg_role": "dirfd",
                  "type_hint": "fd_dir"
                },
                {
                  "name": "file",
                  "arg_role": "path",
                  "type_hint": "string"
                },
                {
                  "name": "flags",
                  "arg_role": "flags",
                  "type_hint": "open_flags"
                },
                {
                  "name": "mode",
                  "arg_role": "mode",
                  "type_hint": "open_mode"
                }
              ]
            }
          ],
          "generation_hints": {
            "target_style": "syzkaller_alias"
          },
          "analysis": {
            "confidence": "high",
            "evidence": [
              "mapped operation open to syscall binding openat"
            ],
            "manual_todo": [],
            "warnings": []
          }
        },
        {
          "op_id": "proc:/proc/mounts#read",
          "op_name": "read",
          "op_type": "fd_io",
          "direction": "out",
          "requirements": {
            "needs_fd": true,
            "needs_path": false,
            "needs_socket": false,
            "needs_struct": false,
            "needs_resource": true
          },
          "syscall_bindings": [
            {
              "syscall_name": "read",
              "syscall_family": "fs_io",
              "syscall_nr_symbol": "__NR_read",
              "call_form": "read",
              "arguments": [
                {
                  "name": "fd",
                  "arg_role": "fd",
                  "type_hint": "fd"
                },
                {
                  "name": "buf",
                  "arg_role": "buffer",
                  "type_hint": "buffer[out]"
                },
                {
                  "name": "count",
                  "arg_role": "length",
                  "type_hint": "len"
                }
              ]
            }
          ],
          "generation_hints": {
            "target_style": "syzkaller_alias"
          },
          "analysis": {
            "confidence": "high",
            "evidence": [
              "mapped operation read to syscall binding read"
            ],
            "manual_todo": [],
            "warnings": []
          }
        }
      ],
      "source": {
        "file": "fs/proc/root.c",
        "line": 371,
        "symbol": null,
        "symbol_kind": null,
        "source_kind": "proc_symlink",
        "related_symbols": []
      },
      "attributes": {
        "resource_kind": "fd",
        "object_kind": "kernel_interface",
        "is_virtual": true,
        "is_path_based": true,
        "is_fd_based": true,
        "is_stateful": false
      },
      "subsystem_details": {
        "node_type": "symlink",
        "registration_kind": "proc_symlink",
        "module_file": "fs/proc/root.c",
        "ops_symbol": null,
        "parent_path": "/proc"
      },
      "analysis": {
        "confidence": "medium",
        "evidence": [
          "discovered proc target /proc/mounts",
          "resolved 2 operations",
          "registration kind: proc_symlink"
        ],
        "manual_todo": [
          "using conservative open/read fallback because ops could not be resolved"
        ],
        "warnings": [
          "using conservative open/read fallback because ops could not be resolved"
        ]
      }
    },
    {
      "interface_id": "proc:/proc/fs",
      "interface_type": "dir_like",
      "subsystem": "proc",
      "display_name": "/proc/fs",
      "access_paths": [
        "/proc/fs"
      ],
      "operations": [
        {
          "op_id": "proc:/proc/fs#open",
          "op_name": "open",
          "op_type": "path_open",
          "direction": "none",
          "requirements": {
            "needs_fd": false,
            "needs_path": true,
            "needs_socket": false,
            "needs_struct": false,
            "needs_resource": true
          },
          "syscall_bindings": [
            {
              "syscall_name": "openat",
              "syscall_family": "fs_path",
              "syscall_nr_symbol": "__NR_openat",
              "call_form": "openat",
              "arguments": [
                {
                  "name": "dirfd",